{
  "catalog_type": "effect_catalog",
  "catalog_version": 1,
  "effects": [
    {
      "effect_id": "builtin-seamless",
      "effect_source": "builtin",
      "family": "seamless",
      "fx_id": "CES_PlugIn_Seamless.dll\\DSP_TR_SeamlessSliding_LC",
      "mode": "builtin-seamless",
      "retrieval_priority": 0,
      "source_documents": [
        "harness/examples/effect_specs/builtin_seamless_sliding.json",
        "harness/examples/render_job.sample.json",
        "harness/examples/render_job.sample.real.json",
        "overlaytrengine/OverlayTrPlugInFx/FxInfo.h",
        "overlaytrengine/OverlayTrPlugInFx/OverlayTrPlugInFx.cpp",
        "overlaytrengine/OverlayTrPlugInFx/TrSeamlessSliding.cpp"
      ],
      "style_hints": [
        "seamless",
        "slide-07",
        "smooth",
        "generated-seamless"
      ]
    },
    {
      "effect_id": "builtin-glitch",
      "effect_source": "builtin",
      "family": "glitch",
      "fx_id": "CES_PlugIn_Glitch.dll\\DSP_TR_04_Bad Signal_4",
      "mode": "builtin-glitch",
      "retrieval_priority": 0,
      "source_documents": [
        "harness/examples/render_job.effect_spec.sample.json",
        "harness/examples/render_job.effect_spec.sample.real.json",
        "overlaytrengine/OverlayTrPlugInFx/FxInfo.h",
        "overlaytrengine/OverlayTrPlugInFx/OverlayTrPlugInFx.cpp",
        "overlaytrengine/OverlayTrPlugInFx/TrGlitch.cpp",
        "overlaytrengine/OverlayTrPlugInFx/TrGlitchInfoManager.cpp"
      ],
      "style_hints": [
        "glitch",
        "glitch-04",
        "generated-glitch"
      ]
    },
    {
      "effect_id": "builtin-camcorder",
      "effect_source": "builtin",
      "family": "camera",
      "fx_id": "CES_PlugIn_Camera.dll\\DSP_TR_Camera_Camcorder",
      "mode": "builtin-camcorder",
      "retrieval_priority": 0,
      "source_documents": [
        "overlaytrengine/OverlayTrPlugInFx/FxInfo.h",
        "overlaytrengine/OverlayTrPlugInFx/OverlayTrPlugInFx.cpp",
        "overlaytrengine/OverlayTrPlugInFx/TrCamcorder.cpp",
        "overlaytrengine/OverlayTrPlugInFx/TrCamcorder_ps.hlsl",
        "overlaytrengine/OverlayTrPlugInFx/TrCamcorder_Blur_ps.hlsl",
        "overlaytrengine/OverlayTrPlugInFx/TrCamcorder_Overlay_ps.hlsl"
      ],
      "style_hints": [
        "camera",
        "camera-02",
        "camcorder"
      ]
    },
    {
      "effect_id": "builtin-particle-spray",
      "effect_source": "builtin",
      "family": "particle",
      "fx_id": "CES_PlugIn_ParticleSpray.dll\\DSP_TR_Sparkle_01",
      "mode": "builtin-particle-spray",
      "retrieval_priority": 0,
      "source_documents": [
        "overlaytrengine/OverlayTrPlugInFx/FxInfo.h",
        "overlaytrengine/OverlayTrPlugInFx/OverlayTrPlugInFx.cpp",
        "overlaytrengine/OverlayTrPlugInFx/TrParticleSpray.cpp",
        "overlaytrengine/OverlayTrPlugInFx/TrParticleSprayInfoManager.cpp",
        "overlaytrengine/OverlayTrPlugInFx/TrParticleSpray_ps.hlsl",
        "overlaytrengine/OverlayTrPlugInFx/TrParticleSpray_Particle_ps.hlsl",
        "overlaytrengine/OverlayTrPlugInFx/TrParticleSpray_Particle_vs.hlsl"
      ],
      "style_hints": [
        "particle",
        "sparkle-01",
        "sparkle",
        "spray"
      ]
    },
    {
      "effect_id": "builtin-frame-overlay",
      "effect_source": "builtin",
      "family": "overlay",
      "fx_id": "CES_PlugIn_FrameOverlay.dll\\DSP_TR_FrameOverlay_01",
      "mode": "builtin-frame-overlay",
      "retrieval_priority": 0,
      "source_documents": [
        "overlaytrengine/OverlayTrPlugInFx/FxInfo.h",
        "overlaytrengine/OverlayTrPlugInFx/OverlayTrPlugInFx.cpp",
        "overlaytrengine/OverlayTrPlugInFx/TrFrameOverlay.cpp",
        "overlaytrengine/OverlayTrPlugInFx/TrFrameOverlay_ps.hlsl",
        "overlaytrengine/OverlayTrPlugInFx/TrFrameOverlay_Noise_ps.hlsl"
      ],
      "style_hints": [
        "frame-overlay",
        "film-roll-01",
        "film-roll",
        "overlay"
      ]
    },
    {
      "effect_id": "builtin-blur",
      "effect_source": "builtin",
      "family": "blur",
      "fx_id": "Blur_DollarBokeh",
      "mode": "builtin-blur",
      "retrieval_priority": 0,
      "source_documents": [
        "overlaytrengine/OverlayTrPlugInFx/FxInfo.h",
        "overlaytrengine/OverlayTrPlugInFx/OverlayTrPlugInFx.cpp",
        "overlaytrengine/OverlayTrPlugInFx/TrAsWindLib.h",
        "overlaytrengine/OverlayTrPlugInFx/TrAsWindLib.cpp"
      ],
      "style_hints": [
        "blur-dollarbokeh",
        "blur",
        "bokeh"
      ]
    },
    {
      "effect_id": "builtin-blur-upgrow",
      "effect_source": "builtin",
      "family": "blur",
      "fx_id": "Blur_UpGrow",
      "mode": "builtin-blur-upgrow",
      "retrieval_priority": 0,
      "source_documents": [
        "overlaytrengine/OverlayTrPlugInFx/FxInfo.h",
        "overlaytrengine/OverlayTrPlugInFx/OverlayTrPlugInFx.cpp",
        "overlaytrengine/OverlayTrPlugInFx/TrAsWindLib.h",
        "overlaytrengine/OverlayTrPlugInFx/TrAsWindLib.cpp"
      ],
      "style_hints": [
        "blur-upgrow",
        "upgrow"
      ]
    },
    {
      "effect_id": "builtin-blur-shakezoom",
      "effect_source": "builtin",
      "family": "blur",
      "fx_id": "Blur_ShakeZoom",
      "mode": "builtin-blur-shakezoom",
      "retrieval_priority": 0,
      "source_documents": [
        "overlaytrengine/OverlayTrPlugInFx/FxInfo.h",
        "overlaytrengine/OverlayTrPlugInFx/OverlayTrPlugInFx.cpp",
        "overlaytrengine/OverlayTrPlugInFx/TrAsWindLib.h",
        "overlaytrengine/OverlayTrPlugInFx/TrAsWindLib.cpp"
      ],
      "style_hints": [
        "blur-shakezoom",
        "shakezoom"
      ]
    },
    {
      "effect_id": "builtin-blur-diagblur",
      "effect_source": "builtin",
      "family": "blur",
      "fx_id": "Blur_DiagBlur",
      "mode": "builtin-blur-diagblur",
      "retrieval_priority": 0,
      "source_documents": [
        "overlaytrengine/OverlayTrPlugInFx/FxInfo.h",
        "overlaytrengine/OverlayTrPlugInFx/OverlayTrPlugInFx.cpp",
        "overlaytrengine/OverlayTrPlugInFx/TrAsWindLib.h",
        "overlaytrengine/OverlayTrPlugInFx/TrAsWindLib.cpp"
      ],
      "style_hints": [
        "blur-diagblur",
        "diagblur"
      ]
    },
    {
      "effect_id": "builtin-blur-hexbokeh",
      "effect_source": "builtin",
      "family": "blur",
      "fx_id": "Blur_HexBokeh",
      "mode": "builtin-blur-hexbokeh",
      "retrieval_priority": 0,
      "source_documents": [
        "overlaytrengine/OverlayTrPlugInFx/FxInfo.h",
        "overlaytrengine/OverlayTrPlugInFx/OverlayTrPlugInFx.cpp",
        "overlaytrengine/OverlayTrPlugInFx/TrAsWindLib.h",
        "overlaytrengine/OverlayTrPlugInFx/TrAsWindLib.cpp"
      ],
      "style_hints": [
        "blur-hexbokeh",
        "hexbokeh"
      ]
    },
    {
      "effect_id": "builtin-blur-diamondbokeh",
      "effect_source": "builtin",
      "family": "blur",
      "fx_id": "Blur_DiamondBokeh",
      "mode": "builtin-blur-diamondbokeh",
      "retrieval_priority": 0,
      "source_documents": [
        "overlaytrengine/OverlayTrPlugInFx/FxInfo.h",
        "overlaytrengine/OverlayTrPlugInFx/OverlayTrPlugInFx.cpp",
        "overlaytrengine/OverlayTrPlugInFx/TrAsWindLib.h",
        "overlaytrengine/OverlayTrPlugInFx/TrAsWindLib.cpp"
      ],
      "style_hints": [
        "blur-diamondbokeh",
        "diamondbokeh"
      ]
    },
    {
      "effect_id": "builtin-blur-fadeblur",
      "effect_source": "builtin",
      "family": "blur",
      "fx_id": "Blur_FadeBlur",
      "mode": "builtin-blur-fadeblur",
      "retrieval_priority": 0,
      "source_documents": [
        "overlaytrengine/OverlayTrPlugInFx/FxInfo.h",
        "overlaytrengine/OverlayTrPlugInFx/OverlayTrPlugInFx.cpp",
        "overlaytrengine/OverlayTrPlugInFx/TrAsWindLib.h",
        "overlaytrengine/OverlayTrPlugInFx/TrAsWindLib.cpp"
      ],
      "style_hints": [
        "blur-fadeblur",
        "fadeblur"
      ]
    },
    {
      "effect_id": "builtin-blur-rotateblur",
      "effect_source": "builtin",
      "family": "blur",
      "fx_id": "Blur_RotateBlur",
      "mode": "builtin-blur-rotateblur",
      "retrieval_priority": 0,
      "source_documents": [
        "overlaytrengine/OverlayTrPlugInFx/FxInfo.h",
        "overlaytrengine/OverlayTrPlugInFx/OverlayTrPlugInFx.cpp",
        "overlaytrengine/OverlayTrPlugInFx/TrAsWindLib.h",
        "overlaytrengine/OverlayTrPlugInFx/TrAsWindLib.cpp"
      ],
      "style_hints": [
        "blur-rotateblur",
        "rotateblur"
      ]
    },
    {
      "effect_id": "builtin-blur-dimfade",
      "effect_source": "builtin",
      "family": "blur",
      "fx_id": "Blur_DimFade",
      "mode": "builtin-blur-dimfade",
      "retrieval_priority": 0,
      "source_documents": [
        "overlaytrengine/OverlayTrPlugInFx/FxInfo.h",
        "overlaytrengine/OverlayTrPlugInFx/OverlayTrPlugInFx.cpp",
        "overlaytrengine/OverlayTrPlugInFx/TrAsWindLib.h",
        "overlaytrengine/OverlayTrPlugInFx/TrAsWindLib.cpp"
      ],
      "style_hints": [
        "blur-dimfade",
        "dimfade"
      ]
    },
    {
      "effect_id": "builtin-ui-snapshot",
      "effect_source": "builtin",
      "family": "ui",
      "fx_id": "UI_Snapshot",
      "mode": "builtin-ui-snapshot",
      "retrieval_priority": 0,
      "source_documents": [
        "overlaytrengine/OverlayTrPlugInFx/FxInfo.h",
        "overlaytrengine/OverlayTrPlugInFx/OverlayTrPlugInFx.cpp",
        "overlaytrengine/OverlayTrPlugInFx/TrAsWindLib.h",
        "overlaytrengine/OverlayTrPlugInFx/TrAsWindLib.cpp"
      ],
      "style_hints": [
        "ui-snapshot",
        "ui",
        "snapshot"
      ]
    },
    {
      "effect_id": "builtin-ui-app-swipe",
      "effect_source": "builtin",
      "family": "ui",
      "fx_id": "UI_AppSwipe",
      "mode": "builtin-ui-app-swipe",
      "retrieval_priority": 0,
      "source_documents": [
        "overlaytrengine/OverlayTrPlugInFx/FxInfo.h",